{
  "measurement_event_id": "me:gf:intake_01:resp_abc123",
  "subject_id": "client_789",
  "timestamp": "2026-01-15T10:30:00Z",
  "observations": [
    {
      "measure_id": "phq9",
      "components": [
        {"component_id": "total_score", "value": 12, "label": "Moderate depression"},
        {"component_id": "q1", "value": 1, "label": null},
        {"component_id": "q2", "value": 2, "label": null}
      ]
    }
  ],
  "source": {
    "form_correlation_id": "corr_xyz123"
  }
}
